STATE,STATE FIPS,COUNTY,COUNTY FIPS,FACILITY,EIS ID,ADDRESS,CITY,ZIP CODE,POLLUTANT,POLLUTANT TYPE,EMISSIONS,UNIT OF MEASURE,FACILITY TYPE,NAICS CODE,NAICS DESCRIPTION
CA,06,Alameda,06001,LANDA'S PAINTING AND FINISHING,14271611,4131 BUSINESS CENTER DR,FREMONT,94538,Nitrogen Oxides,CAP,0.06779835,TON,,332812,"METAL COATING, ENGRAVING (EXCEPT JEWELRY AND SILVERWARE), AND ALLIED SERVICES TO MANUFACTURERS."
CA,06,Alameda,06001,CUMMINS INC,10473611,14775 WICKS BOULEVARD,SAN LEANDRO,94577,Nitrogen Oxides,CAP,0.066709565,TON,,333618,OTHER ENGINE EQUIPMENT MANUFACTURING.
CA,06,Alameda,06001,XOMA US LLC,10503011,2910 W 7TH STREET,BERKELEY,94710,Nitrogen Oxides,CAP,0.06517696,TON,,325412,PHARMACEUTICAL PREPARATION MANUFACTURING.
CA,06,Alameda,06001,PACIFIC BELL,128211,15125 HESPERIAN BLVD,SAN LEANDRO,94578,Nitrogen Oxides,CAP,0.06451202,TON,,517111,
CA,06,Alameda,06001,COUNTER CULTURE COFFEE,18697811,1329 64TH STREET,EMERYVILLE,94608,Nitrogen Oxides,CAP,0.063822238,TON,,311920,COFFEE AND TEA MANUFACTURING.
CA,06,Alameda,06001,CITY OF HAYWARD WELL C,16022711,"29050 HESPERIAN BLVD, WELL C",HAYWARD,94545,Nitrogen Oxides,CAP,0.06263532,TON,,221112,FOSSIL FUEL ELECTRIC POWER GENERATION.
CA,06,Alameda,06001,ORACLE AMERICA,10460911,5805 OWENS DRIVE,PLEASANTON,94588,Nitrogen Oxides,CAP,0.06226361,TON,,334610,
CA,06,Alameda,06001,CAL HI TEC FINISHING LLC,10518811,"1680 W WINTON AVE, UNIT #1",HAYWARD,94545,Nitrogen Oxides,CAP,0.06114071,TON,,332813,"ELECTROPLATING, PLATING, POLISHING, ANODIZING, AND COLORING."
CA,06,Alameda,06001,ALAMEDA COUNTY WATER DISTRICT,197511,43885 SO GRIMMER BLVD,FREMONT,94538,Nitrogen Oxides,CAP,0.06021434,TON,,221310,WATER SUPPLY AND IRRIGATION SYSTEMS.
CA,06,Alameda,06001,EAST BAY MUNICIPAL UTILITY DIST,14059411,1100 21ST STREET,OAKLAND,94607,Nitrogen Oxides,CAP,0.059433803,TON,,221310,WATER SUPPLY AND IRRIGATION SYSTEMS.
CA,06,Alameda,06001,EAST BAY REGIONAL PARK DISTRICT,10479111,17930 LAKE CHABOT ROAD,CASTRO VALLEY,94546,Nitrogen Oxides,CAP,0.058307388,TON,,238210,ELECTRICAL CONTRACTORS.
CA,06,Alameda,06001,MACH II 180 GRAND LLC,13799311,180 GRAND AVENUE,OAKLAND,94612,Nitrogen Oxides,CAP,0.05747436,TON,,221112,FOSSIL FUEL ELECTRIC POWER GENERATION.
CA,06,Alameda,06001,PACIFIC RENAISSANCE PLAZA,18490711,"388 9TH ST, STE 229",OAKLAND,94607,Nitrogen Oxides,CAP,0.05730555,TON,,531120,LESSORS OF NONRESIDENTIAL BUILDINGS (EXCEPT MINIWAREHOUSES).
CA,06,Alameda,06001,THE CLOROX COMPANY,18706111,4900 JOHNSON DRIVE,PLEASANTON,94588,Nitrogen Oxides,CAP,0.0563014,TON,,325612,POLISH AND OTHER SANITATION GOOD MANUFACTURING.
CA,06,Alameda,06001,"ABAXIS, INC",15737511,3240 WHIPPLE ROAD,UNION CITY,94587,Nitrogen Oxides,CAP,0.055485067,TON,,334510,ELECTROMEDICAL AND ELECTROTHERAPEUTIC APPARATUS MANUFACTURING.
CA,06,Alameda,06001,"HAYWARD POINT EDEN I, LP C/O CBRE",18494211,3955 TRUST WAY,HAYWARD,94545,Nitrogen Oxides,CAP,0.05526476,TON,,531120,LESSORS OF NONRESIDENTIAL BUILDINGS (EXCEPT MINIWAREHOUSES).
CA,06,Alameda,06001,"HACIENDA PORTFOLIO VENTURE, LLC (CBRE AGENT)",15941911,4698 WILLOW ROAD,PLEASANTON,94588,Nitrogen Oxides,CAP,0.0550493,TON,,531120,LESSORS OF NONRESIDENTIAL BUILDINGS (EXCEPT MINIWAREHOUSES).
CA,06,Alameda,06001,GARRISON COMMANDER-CAMP PARKS,18128611,620 5TH STREET,DUBLIN,94568,Nitrogen Oxides,CAP,0.05498174,TON,,721211,RV (RECREATIONAL VEHICLE) PARKS AND CAMPGROUNDS.
CA,06,Alameda,06001,VALLEY PET CENTER,18131311,189 CONTRACTORS STREET,LIVERMORE,94550,Nitrogen Oxides,CAP,0.05480364,TON,,812220,CEMETERIES AND CREMATORIES.
CA,06,Alameda,06001,PACIFIC BELL,126911,2100 CENTRAL AVENUE,ALAMEDA,94501,Nitrogen Oxides,CAP,0.05465928,TON,,517111,
CA,06,Alameda,06001,VERIZON BUSINESS - OKLPCA,14235311,7TH ST & NE CORNER OF I 880,OAKLAND,94607,Nitrogen Oxides,CAP,0.05458655,TON,,517111,
CA,06,Alameda,06001,LIVERMORE MUNICIPAL WATER - ALTAMONT PUMP STATION,10488011,8756 PATTERSON PASS RD,LIVERMORE,94551,Nitrogen Oxides,CAP,0.05345005,TON,,221320,SEWAGE TREATMENT FACILITIES.
CA,06,Alameda,06001,OAKLAND UNIFIED SCHOOL DISTRICT,17245011,1011 UNION STREET,OAKLAND,94607,Nitrogen Oxides,CAP,0.05323882,TON,,611110,ELEMENTARY AND SECONDARY SCHOOLS.
CA,06,Alameda,06001,FEDEX EXPRESS-OAKH,13761511,1 SALLY RIDE WAY,OAKLAND,94621,Nitrogen Oxides,CAP,0.053185832,TON,,484122,"GENERAL FREIGHT TRUCKING, LONG-DISTANCE, LESS THAN TRUCKLOAD."
CA,06,Alameda,06001,SSA TERMINALS (OAKLAND) LLC,10476911,1999 MIDDLE HARBOR RD,OAKLAND,94607,Nitrogen Oxides,CAP,0.05278258,TON,,488510,FREIGHT TRANSPORTATION ARRANGEMENT.
CA,06,Alameda,06001,PACIFIC BELL,127611,2112 FRUITVALE AVE,OAKLAND,94601,Nitrogen Oxides,CAP,0.05278258,TON,,517111,
CA,06,Alameda,06001,SAFEWAY INC #1197,18131211,1790 DECOTO ROAD,UNION CITY,94587,Nitrogen Oxides,CAP,0.05274883,TON,,445110,SUPERMARKETS AND OTHER GROCERY (EXCEPT CONVENIENCE) STORES.
CA,06,Alameda,06001,T-MOBILE,10461711,720 2ND STREET,OAKLAND,94607,Nitrogen Oxides,CAP,0.05182024,TON,,517112,
CA,06,Alameda,06001,VALASSIS,10492811,6955 MOWRY AVENUE,NEWARK,94560,Nitrogen Oxides,CAP,0.05160961,TON,,513140,
CA,06,Alameda,06001,CITY OF FREMONT-FIRE STATION #4,17248711,1000 PINE STREET,FREMONT,94539,Nitrogen Oxides,CAP,0.05150378,TON,,922160,FIRE PROTECTION.
CA,06,Alameda,06001,CITY OF FREMONT-FIRE STATION #10,18540311,1 DEEP CREEK ROAD,FREMONT,94538,Nitrogen Oxides,CAP,0.05150378,TON,,922160,FIRE PROTECTION.
CA,06,Alameda,06001,CITY OF FREMONT-FIRE STATION #5,18540411,55 HACKAMORE LANE,FREMONT,94539,Nitrogen Oxides,CAP,0.05150378,TON,,922160,FIRE PROTECTION.
CA,06,Alameda,06001,SAN FRANCISCO BAY BRIDGE TOLL PLAZA,17243011,BAY BRIDGE EAST,OAKLAND,94607,Nitrogen Oxides,CAP,0.0510599,TON,,922190,"OTHER JUSTICE, PUBLIC ORDER, AND SAFETY ACTIVITIES."
CA,06,Alameda,06001,TRIMAC TRANSPORTATION INC,476011,3751 BREAKWATER AVE,HAYWARD,94545,Nitrogen Oxides,CAP,0.05105584,TON,,811192,CAR WASHES.
CA,06,Alameda,06001,TRANS PACIFIC CENTRE,14280211,1000 BROADWAY,OAKLAND,94607,Nitrogen Oxides,CAP,0.05067126,TON,,531120,LESSORS OF NONRESIDENTIAL BUILDINGS (EXCEPT MINIWAREHOUSES).
CA,06,Alameda,06001,PACIFIC GAS AND ELECTRIC,10497711,1919 WEBSTER STREET,OAKLAND,94612,Nitrogen Oxides,CAP,0.0502021,TON,,221112,FOSSIL FUEL ELECTRIC POWER GENERATION.
CA,06,Alameda,06001,CITY CENTER 1300 LLC,18545211,1300 CLAY STREET,OAKLAND,94612,Nitrogen Oxides,CAP,0.050108273,TON,,531210,OFFICES OF REAL ESTATE AGENTS AND BROKERS.
CA,06,Alameda,06001,GEORGIA-PACIFIC CORRUGATED LLC,10708111,2800 ALVARADO STREET,SAN LEANDRO,94577,Nitrogen Oxides,CAP,0.04966911,TON,,322211,CORRUGATED AND SOLID FIBER BOX MANUFACTURING.
CA,06,Alameda,06001,CIM GROUP PROPERTIES,15941011,1901 HARRISON STREET,OAKLAND,94612,Nitrogen Oxides,CAP,0.04964387,TON,,531120,LESSORS OF NONRESIDENTIAL BUILDINGS (EXCEPT MINIWAREHOUSES).
CA,06,Alameda,06001,KAISER PLEASANTON TECHNOLOGY CENTER,15714011,4460 HACIENDA DRIVE,PLEASANTON,94588,Nitrogen Oxides,CAP,0.04949832,TON,,621491,HMO MEDICAL CENTERS.
CA,06,Alameda,06001,OAKLAND 14TH OFFICE,10493211,475 14TH STREET,OAKLAND,94612,Nitrogen Oxides,CAP,0.04855996,TON,,531120,LESSORS OF NONRESIDENTIAL BUILDINGS (EXCEPT MINIWAREHOUSES).
CA,06,Alameda,06001,SAFEWAY INC #1932,18543311,4440 TASSAJARA RD,DUBLIN,94568,Nitrogen Oxides,CAP,0.04717822,TON,,445110,SUPERMARKETS AND OTHER GROCERY (EXCEPT CONVENIENCE) STORES.
CA,06,Alameda,06001,PACIFIC GAS AND ELECTRIC,10497611,42105 BOYCE ROAD,FREMONT,94538,Nitrogen Oxides,CAP,0.04698393,TON,,221112,FOSSIL FUEL ELECTRIC POWER GENERATION.
CA,06,Alameda,06001,THE HOME DEPOT #1017,10511411,21787 HESPERIAN BLVD,HAYWARD,94541,Nitrogen Oxides,CAP,0.0468495,TON,,444110,HOME CENTERS.
CA,06,Alameda,06001,FREMONT HOSPITAL,18540011,39001 SUNDALE DRIVE,FREMONT,94538,Nitrogen Oxides,CAP,0.04634119,TON,,622110,GENERAL MEDICAL AND SURGICAL HOSPITALS.
CA,06,Alameda,06001,"MELROSE METAL FINISHING, INC",10457011,10222 PEARMAIN ST,OAKLAND,94603,Nitrogen Oxides,CAP,0.0461694,TON,,332812,"METAL COATING, ENGRAVING (EXCEPT JEWELRY AND SILVERWARE), AND ALLIED SERVICES TO MANUFACTURERS."
CA,06,Alameda,06001,PACIFIC GAS AND ELECTRIC COMPANY,196311,24300 CLAWITER ROAD,HAYWARD,94545,Nitrogen Oxides,CAP,0.04591725,TON,,221112,FOSSIL FUEL ELECTRIC POWER GENERATION.
CA,06,Alameda,06001,"UNION SANITARY DIST, NEWARK PS",10456311,8700 THORNTON AVE,NEWARK,94560,Nitrogen Oxides,CAP,0.04586344,TON,Wastewater Treatment Facility,221320,SEWAGE TREATMENT FACILITIES.
CA,06,Alameda,06001,PACIFIC BELL,127011,1612 SOLANO AVENUE,ALBANY,94707,Nitrogen Oxides,CAP,0.04480654,TON,,517111,
CA,06,Alameda,06001,AC TRANSIT,204111,1177 47TH STREET,EMERYVILLE,94608,Nitrogen Oxides,CAP,0.044546776,TON,,488490,OTHER SUPPORT ACTIVITIES FOR ROAD TRANSPORTATION.
CA,06,Alameda,06001,FEDEX EXPRESS - OAKRT,13777411,9190 EDES AVENUE,OAKLAND,94603,Nitrogen Oxides,CAP,0.04430943,TON,,484122,"GENERAL FREIGHT TRUCKING, LONG-DISTANCE, LESS THAN TRUCKLOAD."
CA,06,Alameda,06001,365 DATA CENTERS,17252411,1400 65TH STREET,EMERYVILLE,94608,Nitrogen Oxides,CAP,0.0436336,TON,,518210,"DATA PROCESSING, HOSTING, AND RELATED SERVICES."
CA,06,Alameda,06001,EAST BAY MUNICIPAL UTILITY DIST PSH,14191911,4399 OAKPORT STREET,OAKLAND,94619,Nitrogen Oxides,CAP,0.0436336,TON,,221310,WATER SUPPLY AND IRRIGATION SYSTEMS.
CA,06,Alameda,06001,SKYWEST EMERGENCY PUMP STATION,15732511,22487 SKYWEST DRIVE,HAYWARD,94541,Nitrogen Oxides,CAP,0.04324113,TON,,922190,"OTHER JUSTICE, PUBLIC ORDER, AND SAFETY ACTIVITIES."
CA,06,Alameda,06001,HEALTHY COFFEE LIFESTYLES INC,10495211,"6902 PATTERSON PASS RD, UNIT H",LIVERMORE,94550,Nitrogen Oxides,CAP,0.042735944,TON,,311920,COFFEE AND TEA MANUFACTURING.
CA,06,Alameda,06001,PACKAGING CORPORATION OF AMERICA (PCA),17242411,2222 GRANT AVENUE,SAN LORENZO,94580,Nitrogen Oxides,CAP,0.042424255,TON,,322211,CORRUGATED AND SOLID FIBER BOX MANUFACTURING.
CA,06,Alameda,06001,CALIFORNIA HOTEL,17248111,3501 SAN PABLO AVE,OAKLAND,94608,Nitrogen Oxides,CAP,0.04128771,TON,,721110,HOTELS (EXCEPT CASINO HOTELS) AND MOTELS.
CA,06,Alameda,06001,WEATHERFORD BMW,375611,575 W GRAND AVENUE,OAKLAND,94612,Nitrogen Oxides,CAP,0.04096749,TON,"Auto Body, Painting, or Repair Shop",811121,"AUTOMOTIVE BODY, PAINT, AND INTERIOR REPAIR AND MAINTENANCE."
CA,06,Alameda,06001,FORMFACTOR,10496911,501 LAWRENCE ROAD,LIVERMORE,94551,Nitrogen Oxides,CAP,0.04086658,TON,,334514,TOTALIZING FLUID METER AND COUNTING DEVICE MANUFACTURING.
CA,06,Alameda,06001,CITY OF OAKLAND PUBLIC WORKS AGENCY,1088911,7101 EDGEWATER DR,OAKLAND,94621,Nitrogen Oxides,CAP,0.04085606,TON,,624310,VOCATIONAL REHABILITATION SERVICES.
CA,06,Alameda,06001,"LOWE'S HIW, INC /CORPORATE PAYABLES",10505811,52040 UNION LANDING BLVD,UNION CITY,94587,Nitrogen Oxides,CAP,0.0406543,TON,,444110,HOME CENTERS.
CA,06,Alameda,06001,VERIZON WIRELESS (BAY BRIDGE EAST),13818011,107 BURMA ROAD,OAKLAND,94617,Nitrogen Oxides,CAP,0.03991678,TON,,517112,
CA,06,Alameda,06001,MOUNTAIN VIEW CEMETERY ASSOCIATION,309711,5000 PIEDMONT AVE,OAKLAND,94611,Nitrogen Oxides,CAP,0.03958247,TON,Crematory - Human,812210,FUNERAL HOMES AND FUNERAL SERVICES.
CA,06,Alameda,06001,"UNION SANITARY DIST, FREMONT LS",14305511,48101 FREMONT BLVD,FREMONT,94538,Nitrogen Oxides,CAP,0.039270222,TON,,221320,SEWAGE TREATMENT FACILITIES.
CA,06,Alameda,06001,"NEW ENGLAND LEAD BURNING CO, INC",405211,1840 WILLIAMS STREET,SAN LEANDRO,94577,Nitrogen Oxides,CAP,0.03906434,TON,,331314,SECONDARY SMELTING AND ALLOYING OF ALUMINUM.
CA,06,Alameda,06001,"UNION SANITARY DIST, PASEO PADRE LS",138511,6935 PASEO PADRE PKWY,FREMONT,94536,Nitrogen Oxides,CAP,0.038331865,TON,Wastewater Treatment Facility,221320,SEWAGE TREATMENT FACILITIES.
CA,06,Alameda,06001,ALAMEDA COUNTY PUBLIC WORKS AGENCY,15714711,"SULPHUR CREEK, FLOOD CTR PUMP STA",HAYWARD,94541,Nitrogen Oxides,CAP,0.03811858,TON,,925120,ADMINISTRATION OF URBAN PLANNING AND COMMUNITY AND RURAL DEVELOPMENT.
CA,06,Alameda,06001,LAM RESEARCH CORPORATION,13792611,1 PORTOLA AVENUE,LIVERMORE,94550,Nitrogen Oxides,CAP,0.03776596,TON,,334413,SEMICONDUCTOR AND RELATED DEVICE MANUFACTURING.
CA,06,Alameda,06001,CITY OF BERKELEY FIRE STATION #6,18491311,999 CEDAR STREET,BERKELEY,94710,Nitrogen Oxides,CAP,0.03768038,TON,,921190,OTHER GENERAL GOVERNMENT SUPPORT.
CA,06,Alameda,06001,OPENTEXT CORPORATION,18545411,6801 KOLL CENTER PKWY,PLEASANTON,94566,Nitrogen Oxides,CAP,0.03753426,TON,,221112,FOSSIL FUEL ELECTRIC POWER GENERATION.
CA,06,Alameda,06001,LUCKY #714,14245511,5000 MOWRY AVENUE,FREMONT,94538,Nitrogen Oxides,CAP,0.03683584,TON,,445110,SUPERMARKETS AND OTHER GROCERY (EXCEPT CONVENIENCE) STORES.
CA,06,Alameda,06001,US POSTAL SERVICE - BUILDING MAINTENANCE,16080611,1675 7TH STREET,OAKLAND,94615,Nitrogen Oxides,CAP,0.036750379,TON,,491110,POSTAL SERVICE.
CA,06,Alameda,06001,CORAD INC.,194011,25181 HUNTWOOD AVE,HAYWARD,94544,Nitrogen Oxides,CAP,0.03527142,TON,,332812,"METAL COATING, ENGRAVING (EXCEPT JEWELRY AND SILVERWARE), AND ALLIED SERVICES TO MANUFACTURERS."
CA,06,Alameda,06001,"CENTURYLINK COMMUNICATIONS, LLC",13815711,6440 SHELLMOUND STREET,EMERYVILLE,94608,Nitrogen Oxides,CAP,0.03497784,TON,,517111,
CA,06,Alameda,06001,MODERN COFFEE ENTERPRISES INC,16062611,4059 EMERY STREET,EMERYVILLE,94608,Nitrogen Oxides,CAP,0.034263095,TON,,311920,COFFEE AND TEA MANUFACTURING.
CA,06,Alameda,06001,PETER JAMES COFFEE INC,10518411,1964 REPUBLIC AVENUE,SAN LEANDRO,94577,Nitrogen Oxides,CAP,0.03388248,TON,,311920,COFFEE AND TEA MANUFACTURING.
CA,06,Alameda,06001,VERIZON WIRELESS - HWY 205/580,13776311,16163 GRANT LINE RD & HWY205&580 9,LIVERMORE,95391,Nitrogen Oxides,CAP,0.03354626,TON,,517112,
CA,06,Alameda,06001,KBSIII TOWERS AT EMERYVILLE LLC,16025111,2200 POWELL STREET,EMERYVILLE,94608,Nitrogen Oxides,CAP,0.03284248,TON,,221112,FOSSIL FUEL ELECTRIC POWER GENERATION.
CA,06,Alameda,06001,"FEDEX FREIGHT, INC",17250711,"29001 HOPKINS ST, FEDEX FREIGHT",HAYWARD,94545,Nitrogen Oxides,CAP,0.032801672,TON,,484122,"GENERAL FREIGHT TRUCKING, LONG-DISTANCE, LESS THAN TRUCKLOAD."
CA,06,Alameda,06001,ALAMEDA COUNTY PUBLIC WORKS AGENCY,13985011,"FLOOD LEVEE, E OF INDUSTRIAL BLVD",HAYWARD,94545,Nitrogen Oxides,CAP,0.03251407,TON,,925120,ADMINISTRATION OF URBAN PLANNING AND COMMUNITY AND RURAL DEVELOPMENT.
CA,06,Alameda,06001,EAST BAY MUNICIPAL UTILITY DIST,403111,1200 21ST STREET,OAKLAND,94607,Nitrogen Oxides,CAP,0.032473266,TON,,221310,WATER SUPPLY AND IRRIGATION SYSTEMS.
CA,06,Alameda,06001,"SEVENTH STREET PROPERTIES VII, LLC",18542211,740 HEINZ AVENUE,BERKELEY,94710,Nitrogen Oxides,CAP,0.03245155,TON,,531312,NONRESIDENTIAL PROPERTY MANAGERS.
CA,06,Alameda,06001,CITY OF FREMONT,15724711,47200 LAKEWOOD BLVD,FREMONT,94538,Nitrogen Oxides,CAP,0.03238114,TON,,221112,FOSSIL FUEL ELECTRIC POWER GENERATION.
CA,06,Alameda,06001,"CITY OF OAKLAND , PUBLIC WORKS FACILITIES",10496711,455 7TH STREET,OAKLAND,94612,Nitrogen Oxides,CAP,0.0323733,TON,,922120,POLICE PROTECTION.
CA,06,Alameda,06001,AC TRANSIT DISTRICT - CENTRAL MAINTENANCE BUILDING,141411,10626 INTERNATIONAL BLVD,OAKLAND,94603,Nitrogen Oxides,CAP,0.032242912,TON,,485111,MIXED MODE TRANSIT SYSTEMS.
CA,06,Alameda,06001,S F BAY AREA RAPID TRANSIT DISTRICT,10498511,3301 NORBRIDGE DRIVE,CASTRO VALLEY,94546,Nitrogen Oxides,CAP,0.03213871,TON,,221112,FOSSIL FUEL ELECTRIC POWER GENERATION.
CA,06,Alameda,06001,BORDEN LIGHTING,18134211,460 ROLAND WAY,OAKLAND,94621,Nitrogen Oxides,CAP,0.03171892,TON,,335131,
CA,06,Alameda,06001,VERIZON BUSINESS - OKMFCA,14258711,1999 HARRISON STREET,OAKLAND,94612,Nitrogen Oxides,CAP,0.03160632,TON,,517111,
CA,06,Alameda,06001,ELDER CARE ALLIANCE OF UNION CITY,17242811,33883 ALVARADO NILES RD,UNION CITY,94587,Nitrogen Oxides,CAP,0.03151768,TON,,623312,HOMES FOR THE ELDERLY.
CA,06,Alameda,06001,BAY AREA RAPID TRANSIT,17252611,550 W MACARTHUR BLVD,OAKLAND,94609,Nitrogen Oxides,CAP,0.03143495,TON,,485119,OTHER URBAN TRANSIT SYSTEMS.
CA,06,Alameda,06001,CITY OF NEWARK FIRE STATION #1,10472811,7550 THORNTON AVE,NEWARK,94560,Nitrogen Oxides,CAP,0.03143495,TON,,922160,FIRE PROTECTION.
CA,06,Alameda,06001,KAISER PERMANENTE IVF CLINIC,13790211,"39141 CIVIC CENTER DR, #350",FREMONT,94537,Nitrogen Oxides,CAP,0.03118498,TON,,621111,OFFICES OF PHYSICIANS (EXCEPT MENTAL HEALTH SPECIALISTS).
CA,06,Alameda,06001,AVALON BAY,15757311,24 UNION SQUARE,UNION CITY,94587,Nitrogen Oxides,CAP,0.02969246,TON,,531120,LESSORS OF NONRESIDENTIAL BUILDINGS (EXCEPT MINIWAREHOUSES).
CA,06,Alameda,06001,"ROSS DRESS FOR LESS, INC",17250311,"5130 HACIENDA DR, BLDG B",DUBLIN,94568,Nitrogen Oxides,CAP,0.02940898,TON,,458110,
CA,06,Alameda,06001,EAST BAY MUNICIPAL UTILITY DIST PSQ,10501811,1451 2ND STREET,BERKELEY,94710,Nitrogen Oxides,CAP,0.02908906,TON,,221310,WATER SUPPLY AND IRRIGATION SYSTEMS.
CA,06,Alameda,06001,PACIFIC BELL,13760611,36789 FREMONT BLVD,FREMONT,94536,Nitrogen Oxides,CAP,0.02901301,TON,,517111,
CA,06,Alameda,06001,ORO LOMA SANITARY DISTRICT-CANYON LIFT STATION,17250211,CANYON DR & VALLEY VIEW,HAYWARD,94541,Nitrogen Oxides,CAP,0.02894831,TON,,221320,SEWAGE TREATMENT FACILITIES.
CA,06,Alameda,06001,KBS SOR II OAKLAND CITY CENTER LLC,18496811,505 14TH STREET,OAKLAND,94612,Nitrogen Oxides,CAP,0.028624574,TON,,531120,LESSORS OF NONRESIDENTIAL BUILDINGS (EXCEPT MINIWAREHOUSES).
CA,06,Alameda,06001,CITY OF BERKELEY - CORPORATION YARD,18490811,1326 ALLSTON WAY,BERKELEY,94702,Nitrogen Oxides,CAP,0.02837232,TON,,921190,OTHER GENERAL GOVERNMENT SUPPORT.
CA,06,Alameda,06001,COMMUNICATION & CONTROL INC,17245611,"MT ALLISON, END OF WELLER ROAD",FREMONT,94539,Nitrogen Oxides,CAP,0.028299409,TON,,517121,
CA,06,Alameda,06001,CITY OF FREMONT,15959911,4355 CENTRAL AVENUE,FREMONT,94536,Nitrogen Oxides,CAP,0.02773423,TON,,922160,FIRE PROTECTION.
CA,06,Alameda,06001,SAFEWAY INC #971,18543011,22280 FOOTHILL BLVD,HAYWARD,94541,Nitrogen Oxides,CAP,0.02736376,TON,,445110,SUPERMARKETS AND OTHER GROCERY (EXCEPT CONVENIENCE) STORES.
CA,06,Alameda,06001,EAST BAY MUNICIPAL UTILITY DISTRICT,10453011,5601 OAKPORT STREET,OAKLAND,94621,Nitrogen Oxides,CAP,0.02697775,TON,Wastewater Treatment Facility,221320,SEWAGE TREATMENT FACILITIES.
CA,06,Alameda,06001,CITY OF HAYWARD DEPARTMENT OF PUBLIC WORKS,14049311,1241 WALPERT STREET,HAYWARD,94541,Nitrogen Oxides,CAP,0.02674317,TON,,813910,BUSINESS ASSOCIATIONS.
CA,06,Alameda,06001,ALAMEDA COUNTY WATER DISTRICT,18540511,1111 MOWRY AVENUE,FREMONT,94536,Nitrogen Oxides,CAP,0.02623328,TON,,221310,WATER SUPPLY AND IRRIGATION SYSTEMS.
CA,06,Alameda,06001,AT&T CORP,13777611,344 20TH STREET,OAKLAND,94609,Nitrogen Oxides,CAP,0.02619426,TON,,517810,
CA,06,Alameda,06001,"LEVEL 3 COMMUNICATIONS, LLC",18542911,4511 WILLOW ROAD,PLEASANTON,94588,Nitrogen Oxides,CAP,0.02602844,TON,,517111,
CA,06,Alameda,06001,CITY OF HAYWARD WELL D2,16023311,"1201 W WINTON AVE, WELL D",HAYWARD,94545,Nitrogen Oxides,CAP,0.02580481,TON,,221112,FOSSIL FUEL ELECTRIC POWER GENERATION.
CA,06,Alameda,06001,HEAT & CONTROL INC,4770711,21121 CABOT BLVD,HAYWARD,94545,Nitrogen Oxides,CAP,0.02561552,TON,,333241,
CA,06,Alameda,06001,"TESLA MOTORS, INC",18344211,3777 SPINNAKER CT,FREMONT,94538,Nitrogen Oxides,CAP,0.02557546,TON,,336110,
CA,06,Alameda,06001,PACIFIC GAS AND ELECTRIC,10497911,41800 BOSCELL ROAD,FREMONT,94538,Nitrogen Oxides,CAP,0.02553046,TON,,221112,FOSSIL FUEL ELECTRIC POWER GENERATION.
CA,06,Alameda,06001,PRIME NOW LLC,18135111,1000 FOLGER AVENUE,BERKELEY,94710,Nitrogen Oxides,CAP,0.02540681,TON,,454110,ELECTRONIC SHOPPING AND MAIL-ORDER HOUSES.
CA,06,Alameda,06001,PACIFIC BELL,127811,2810 MOUNTAIN BLVD,OAKLAND,94602,Nitrogen Oxides,CAP,0.02510105,TON,,517111,
CA,06,Alameda,06001,"THE HOME DEPOT USA, INC - STORE #0635",13745811,30055 INDSTRIAL PKWY,UNION CITY,94587,Nitrogen Oxides,CAP,0.025059,TON,,327110,
CA,06,Alameda,06001,COFFEE HOUSE SUPPLY,773011,1310 65TH STREET,EMERYVILLE,94608,Nitrogen Oxides,CAP,0.024514849,TON,,311920,COFFEE AND TEA MANUFACTURING.
CA,06,Alameda,06001,EBMUD UPPER SAN LEANDRO WTP,10523311,7700 GREENLY DRIVE,OAKLAND,94605,Nitrogen Oxides,CAP,0.02411577,TON,,221310,WATER SUPPLY AND IRRIGATION SYSTEMS.
CA,06,Alameda,06001,"ROSEWOOD COMMONS PROPERTY OWNER, LLC",18495111,4420 ROSEWOOD DRIVE,PLEASANTON,94588,Nitrogen Oxides,CAP,0.0239281,TON,,517112,
CA,06,Alameda,06001,"LOWE'S OF DUBLIN, CA#2273",13805411,GRATTON ST & NORTHSIDE DR,DUBLIN,94568,Nitrogen Oxides,CAP,0.02366377,TON,,455219,
CA,06,Alameda,06001,"RJ CHASE COMPANY, INC",6499111,4000 TARA COURT,UNION CITY,94587,Nitrogen Oxides,CAP,0.023478661,TON,,332812,"METAL COATING, ENGRAVING (EXCEPT JEWELRY AND SILVERWARE), AND ALLIED SERVICES TO MANUFACTURERS."
CA,06,Alameda,06001,VERIZON WIRELESS (HAYWARD WEST WINTON),15917411,2181 W WINTON AVE,HAYWARD,94545,Nitrogen Oxides,CAP,0.02345892,TON,,517112,
CA,06,Alameda,06001,CITY OF ALAMEDA PUBLIC WORKS DEPARTMENT,16022011,1300 PARK STREET,ALAMEDA,94501,Nitrogen Oxides,CAP,0.02345892,TON,,221112,FOSSIL FUEL ELECTRIC POWER GENERATION.
CA,06,Alameda,06001,"FOX TELEVISION STATIONS, INC ON BEHALF OF KICU",17248511,"9530 WELLER RD, MOUNMENT PEAK",FREMONT,94539,Nitrogen Oxides,CAP,0.023458916,TON,,516120,
CA,06,Alameda,06001,LEVEL 3 COMMUNICATIONS LLC,14287111,1330 BROADWAY,OAKLAND,94612,Nitrogen Oxides,CAP,0.02331671,TON,,518210,"DATA PROCESSING, HOSTING, AND RELATED SERVICES."
CA,06,Alameda,06001,CITY OF HAYWARD 750' RESERVOIR,14244711,26633 PARKSIDE DR,HAYWARD,94542,Nitrogen Oxides,CAP,0.02314927,TON,,221112,FOSSIL FUEL ELECTRIC POWER GENERATION.
CA,06,Alameda,06001,PACIFIC GAS AND ELECTRIC COMPANY,196411,3797 1ST STREET,LIVERMORE,94550,Nitrogen Oxides,CAP,0.0230282,TON,,221112,FOSSIL FUEL ELECTRIC POWER GENERATION.
CA,06,Alameda,06001,SUTTER BAY MEDICAL FOUNDATION DBA PALO ALTO M F,18541811,3200 KEARNEY STREET,FREMONT,94538,Nitrogen Oxides,CAP,0.02301538,TON,,622110,GENERAL MEDICAL AND SURGICAL HOSPITALS.
CA,06,Alameda,06001,ALAMEDA COUNTY GSA,18496311,7195 OAKPORT STREET,OAKLAND,94621,Nitrogen Oxides,CAP,0.02292476,TON,,921190,OTHER GENERAL GOVERNMENT SUPPORT.
CA,06,Alameda,06001,S F BAY AREA RAPID TRANSIT DISTRICT,10498311,5801 OWENS DRIVE,PLEASANTON,94588,Nitrogen Oxides,CAP,0.02275516,TON,,488111,AIR TRAFFIC CONTROL.
CA,06,Alameda,06001,KBSIII AT EMERYVILLE LLC,16025011,2000 POWELL STREET,EMERYVILLE,94608,Nitrogen Oxides,CAP,0.022755149,TON,,221112,FOSSIL FUEL ELECTRIC POWER GENERATION.
CA,06,Alameda,06001,PACIFIC GAS AND ELECTRIC COMPANY/ENVR FIELD SVCS,196511,4801 OAKPORT STREET,OAKLAND,94601,Nitrogen Oxides,CAP,0.02272339,TON,,221122,ELECTRIC POWER DISTRIBUTION.
CA,06,Alameda,06001,L A SMITH & SONS BODY SHOP,383511,903 WILLIAMS STREET,SAN LEANDRO,94577,Nitrogen Oxides,CAP,0.02271742,TON,"Auto Body, Painting, or Repair Shop",811121,"AUTOMOTIVE BODY, PAINT, AND INTERIOR REPAIR AND MAINTENANCE."
CA,06,Alameda,06001,"ILLUMINA, INC",16031111,25861 INDUSTRIAL BLVD,HAYWARD,94545,Nitrogen Oxides,CAP,0.02240832,TON,,541714,
CA,06,Alameda,06001,REVANCE THERAPEUTICS INC,15729611,7555 GATEWAY BLVD,NEWARK,94560,Nitrogen Oxides,CAP,0.02192515,TON,,325412,PHARMACEUTICAL PREPARATION MANUFACTURING.
CA,06,Alameda,06001,CITY OF BERKELEY FIRE STATION #2,17246911,2029 BERKELEY WAY,BERKELEY,94705,Nitrogen Oxides,CAP,0.021833,TON,,922160,FIRE PROTECTION.
CA,06,Alameda,06001,"BMR-PACIFIC RESEARCH CENTER, LP",18544311,"7707 GATEWAY BLVD, BUILDING #5",NEWARK,94560,Nitrogen Oxides,CAP,0.0218168,TON,,541714,
CA,06,Alameda,06001,CITY OF PLEASANTON,10492111,3560 DEL VALLE PARKWAY,PLEASANTON,94566,Nitrogen Oxides,CAP,0.02177088,TON,,921190,OTHER GENERAL GOVERNMENT SUPPORT.
CA,06,Alameda,06001,CITY OF OAKLAND,18491811,9333 SENECA STREET,OAKLAND,94605,Nitrogen Oxides,CAP,0.02154898,TON,,921190,OTHER GENERAL GOVERNMENT SUPPORT.
CA,06,Alameda,06001,GLOBAL POWER GROUP INC (TOYS R US) - 5811,9968711,6850 AMADOR PLAZA RD,DUBLIN,94568,Nitrogen Oxides,CAP,0.0215348,TON,,455110,
CA,06,Alameda,06001,TARGET CORPORATION T1926,10475711,1057 EASTSHORE HWY,ALBANY,94706,Nitrogen Oxides,CAP,0.02147003,TON,,455110,
CA,06,Alameda,06001,CITY OF FREMONT,18128811,2000 STEVENSON BLVD,FREMONT,94538,Nitrogen Oxides,CAP,0.02125165,TON,,922120,POLICE PROTECTION.
CA,06,Alameda,06001,PEERY/ARRILLAGA,18136011,7601 DUMBARTON CIR,FREMONT,94555,Nitrogen Oxides,CAP,0.02111302,TON,,221112,FOSSIL FUEL ELECTRIC POWER GENERATION.
CA,06,Alameda,06001,EAST BAY DISCHARGERS AUTHORITY,168111,3000 DAVIS STREET,SAN LEANDRO,94577,Nitrogen Oxides,CAP,0.02083674,TON,,488119,OTHER AIRPORT OPERATIONS.
CA,06,Alameda,06001,BAXTER HEALTHCARE INC,14122211,21026 ALEXANDER CT,HAYWARD,94545,Nitrogen Oxides,CAP,0.020834508,TON,,325412,PHARMACEUTICAL PREPARATION MANUFACTURING.
CA,06,Alameda,06001,SPRINT,14271111,114 BRUSH STREET,OAKLAND,94607,Nitrogen Oxides,CAP,0.02081869,TON,,517112,
CA,06,Alameda,06001,AT&T,10505211,11823 MAIN STREET,SUNOL,94586,Nitrogen Oxides,CAP,0.02064385,TON,,517111,
CA,06,Alameda,06001,S F BAY AREA RAPID TRANSIT DISTRICT,10498611,101 8TH STREET,OAKLAND,94607,Nitrogen Oxides,CAP,0.02064385,TON,,488111,AIR TRAFFIC CONTROL.
CA,06,Alameda,06001,"CENTURYLINK COMMUNICATIONS, LLC",14115111,260 5TH AVENUE,OAKLAND,94606,Nitrogen Oxides,CAP,0.020639787,TON,,517111,
CA,06,Alameda,06001,"MATHESON TRI-GAS, INC",6500411,6775 CENTRAL AVE,NEWARK,94560,Nitrogen Oxides,CAP,0.02059744,TON,,325120,INDUSTRIAL GAS MANUFACTURING.
CA,06,Alameda,06001,AMAZON COM SERVICES INC - OAK5,18135511,38811 CHERRY AVE,NEWARK,94560,Nitrogen Oxides,CAP,0.02058096,TON,,531120,LESSORS OF NONRESIDENTIAL BUILDINGS (EXCEPT MINIWAREHOUSES).
CA,06,Alameda,06001,LEVEL 3 COMMUNICATIONS,18539611,23965 CONNECTICUT ST,HAYWARD,94545,Nitrogen Oxides,CAP,0.02040927,TON,,517111,
CA,06,Alameda,06001,AIR LIQUIDE ELECTRONICS US,138311,5121 BRANDIN COURT,FREMONT,94538,Nitrogen Oxides,CAP,0.02025566,TON,,325120,INDUSTRIAL GAS MANUFACTURING.
CA,06,Alameda,06001,ALAMEDA COUNTY PUBLIC WORKS AGENCY,18539211,2603 FAIRVIEW DRIVE,SAN LEANDRO,94577,Nitrogen Oxides,CAP,0.01921285,TON,,925120,ADMINISTRATION OF URBAN PLANNING AND COMMUNITY AND RURAL DEVELOPMENT.
CA,06,Alameda,06001,"HAWKINS HAWKINS COMPANY, INC",193011,1255 EASTSHORE HWY,BERKELEY,94710,Nitrogen Oxides,CAP,0.01908477,TON,,323113,COMMERCIAL SCREEN PRINTING.
CA,06,Alameda,06001,"RUBY'S ROAST, LLC",17249911,2701 8TH STREET,BERKELEY,94710,Nitrogen Oxides,CAP,0.019064736,TON,,424490,OTHER GROCERY AND RELATED PRODUCTS MERCHANT WHOLESALERS.
