STATE,STATE FIPS,COUNTY,COUNTY FIPS,FACILITY,EIS ID,ADDRESS,CITY,ZIP CODE,POLLUTANT,POLLUTANT TYPE,EMISSIONS,UNIT OF MEASURE,FACILITY TYPE,NAICS CODE,NAICS DESCRIPTION
CA,06,Alameda,06001,ALBANY HIGH SCHOOL,13746911,603 KEY ROUTE BLVD,ALBANY,94706,Nitrogen Oxides,CAP,0.609673,TON,,611110,ELEMENTARY AND SECONDARY SCHOOLS.
CA,06,Alameda,06001,ECI THREE HACIENDA LLC C/O EMBARCADERO REALTY SVCS,15941511,"4305 HACINDA DRIVE, #160",PLEASANTON,94588,Nitrogen Oxides,CAP,0.59913454,TON,,531120,LESSORS OF NONRESIDENTIAL BUILDINGS (EXCEPT MINIWAREHOUSES).
CA,06,Alameda,06001,DESILVA GATES CONSTRUCTION,14007811,11555 DUBLIN BLVD,DUBLIN,94568,Nitrogen Oxides,CAP,0.560924,TON,,236220,COMMERCIAL AND INSTITUTIONAL BUILDING CONSTRUCTION.
CA,06,Alameda,06001,NOR-CAL ROCK INC,18786911,"30120 INDUSTRIAL PKWY, SW",HAYWARD,94544,Nitrogen Oxides,CAP,0.5558463,TON,,327320,READY-MIX CONCRETE MANUFACTURING.
CA,06,Alameda,06001,SAN FRANCISCO ITALIAN FOODS,804911,14054 CATALINA STREET,SAN LEANDRO,94577,Nitrogen Oxides,CAP,0.5425603,TON,,311412,FROZEN SPECIALTY FOOD MANUFACTURING.
CA,06,Alameda,06001,VERIZON WIRELESS PLEASANTON SWITCH,10490711,4440 WILLOW ROAD,PLEASANTON,94588,Nitrogen Oxides,CAP,0.5231715,TON,,517112,
CA,06,Alameda,06001,"BMR-PACIFIC RESEARCH CENTER, LP",14123611,"7677 GATEWAY BLVD, UNWK 12",NEWARK,94560,Nitrogen Oxides,CAP,0.514552841,TON,,334111,ELECTRONIC COMPUTER MANUFACTURING.
CA,06,Alameda,06001,LONZA HAYWARD,447811,1978 W WINTON AVE,HAYWARD,94545,Nitrogen Oxides,CAP,0.49668436,TON,,325412,PHARMACEUTICAL PREPARATION MANUFACTURING.
CA,06,Alameda,06001,AT&T,14257811,221 WINTON AVENUE,HAYWARD,94544,Nitrogen Oxides,CAP,0.48117167,TON,,517111,
CA,06,Alameda,06001,CHABOT COMMUNITY COLLEGE,10488411,25555 HESPERIAN BLVD,HAYWARD,94545,Nitrogen Oxides,CAP,0.47758773,TON,,611210,JUNIOR COLLEGES.
CA,06,Alameda,06001,BROADWAY FRANKLIN LLC,18495611,1111 BROADWAY,OAKLAND,94607,Nitrogen Oxides,CAP,0.47658623,TON,,531120,LESSORS OF NONRESIDENTIAL BUILDINGS (EXCEPT MINIWAREHOUSES).
CA,06,Alameda,06001,CMC ICOS BIOLOGICS INC,18776511,890 HEINZ,BERKELEY,94710,Nitrogen Oxides,CAP,0.4558085,TON,,325414,BIOLOGICAL PRODUCT (EXCEPT DIAGNOSTIC) MANUFACTURING.
CA,06,Alameda,06001,SAAG'S PRODUCTS LLC,18131411,1799 FACTOR AVENUE,SAN LEANDRO,94577,Nitrogen Oxides,CAP,0.448777322,TON,,445110,SUPERMARKETS AND OTHER GROCERY (EXCEPT CONVENIENCE) STORES.
CA,06,Alameda,06001,"FXI, INC",14071611,2451 POLVOROSA STREET,SAN LEANDRO,94577,Nitrogen Oxides,CAP,0.4465061,TON,,326140,POLYSTYRENE FOAM PRODUCT MANUFACTURING.
CA,06,Alameda,06001,SAFEWAY MILK PLANT,512911,2000 ADAMS AVENUE,SAN LEANDRO,94577,Nitrogen Oxides,CAP,0.43963332,TON,Food Products Processing Plant,311511,FLUID MILK MANUFACTURING.
CA,06,Alameda,06001,USPA CITY CENTER LLC C/O HARVEST PROPERTIES,18496511,555 12TH STREET,OAKLAND,94607,Nitrogen Oxides,CAP,0.4350651,TON,,531120,LESSORS OF NONRESIDENTIAL BUILDINGS (EXCEPT MINIWAREHOUSES).
CA,06,Alameda,06001,KINDRED HOSPITAL,15721111,2800 BENEDICT DRIVE,SAN LEANDRO,94577,Nitrogen Oxides,CAP,0.434250413,TON,,622110,GENERAL MEDICAL AND SURGICAL HOSPITALS.
CA,06,Alameda,06001,"DWFIU 1999 HARRISON, LLC",15734511,1999 HARRISON STREET,OAKLAND,94612,Nitrogen Oxides,CAP,0.4335208,TON,,531311,RESIDENTIAL PROPERTY MANAGERS.
CA,06,Alameda,06001,PACIFIC BELL,128311,118 E STREET,UNION CITY,94587,Nitrogen Oxides,CAP,0.4279145,TON,,517111,
CA,06,Alameda,06001,DIGITAL 720 2ND LLC,15974511,720 2ND STREET,OAKLAND,94607,Nitrogen Oxides,CAP,0.42576208,TON,,518210,"DATA PROCESSING, HOSTING, AND RELATED SERVICES."
CA,06,Alameda,06001,CBRE,18496911,"2100 POWELL ST, STE 125",EMERYVILLE,94608,Nitrogen Oxides,CAP,0.41368547,TON,,531120,LESSORS OF NONRESIDENTIAL BUILDINGS (EXCEPT MINIWAREHOUSES).
CA,06,Alameda,06001,ZONE 7 WATER AGENCY,13792411,901 E VINEYARD AVENUE,LIVERMORE,94550,Nitrogen Oxides,CAP,0.40559433,TON,,221310,WATER SUPPLY AND IRRIGATION SYSTEMS.
CA,06,Alameda,06001,VERIZON BUSINESS - HAWDCA,13782511,21350 CABOT BLVD,HAYWARD,94545,Nitrogen Oxides,CAP,0.40331746,TON,,518210,"DATA PROCESSING, HOSTING, AND RELATED SERVICES."
CA,06,Alameda,06001,HENKEL US OPERATIONS CORPORATION,14182811,GRAYSON STREET,BERKELEY,94710,Nitrogen Oxides,CAP,0.402336,TON,,325520,ADHESIVE MANUFACTURING.
CA,06,Alameda,06001,KAISER UNION CITY MEDICAL OFFICES,10496111,3555 WHIPPLE ROAD,UNION CITY,94587,Nitrogen Oxides,CAP,0.394266649,TON,,622110,GENERAL MEDICAL AND SURGICAL HOSPITALS.
CA,06,Alameda,06001,ALAMEDA COUNTY GSA,13760911,2500 FAIRMONT DRIVE,SAN LEANDRO,94578,Nitrogen Oxides,CAP,0.38903115,TON,,922190,"OTHER JUSTICE, PUBLIC ORDER, AND SAFETY ACTIVITIES."
CA,06,Alameda,06001,"CALIFORNIA STATE UNIVERSITY, EAST BAY",343611,25800 CARLOS BEE BLVD,HAYWARD,94542,Nitrogen Oxides,CAP,0.371212322,TON,"Institutional (school, hospital, prison, etc.)",611310,"COLLEGES, UNIVERSITIES, AND PROFESSIONAL SCHOOLS."
CA,06,Alameda,06001,CEDAR LAWN MEMORIAL PARK & MORTUARY,278011,48800 WARM SPRING BLVD,FREMONT,94539,Nitrogen Oxides,CAP,0.3632422,TON,Crematory - Human,812210,FUNERAL HOMES AND FUNERAL SERVICES.
CA,06,Alameda,06001,CALIFORNIA PIE COMPANY,13783711,"7066 LAS POSITAS RD, SUITE A",LIVERMORE,94550,Nitrogen Oxides,CAP,0.3539164,TON,Bakeries,311812,COMMERCIAL BAKERIES.
CA,06,Alameda,06001,"U C BERKELEY, CLARK KERR CAMPUS",13825511,"CLARK KERR CAMPS, WARRING STREET",BERKELEY,94720,Nitrogen Oxides,CAP,0.343613859,TON,,611310,"COLLEGES, UNIVERSITIES, AND PROFESSIONAL SCHOOLS."
CA,06,Alameda,06001,OAKLAND MUSEUM OF CALIFORNIA,18492711,1000 OAK STREET,OAKLAND,94607,Nitrogen Oxides,CAP,0.333307039,TON,,921190,OTHER GENERAL GOVERNMENT SUPPORT.
CA,06,Alameda,06001,BLUE BOTTLE COFFEE COMPANY,18697211,300 WEBSTER STREET,OAKLAND,94607,Nitrogen Oxides,CAP,0.32644102,TON,,311920,COFFEE AND TEA MANUFACTURING.
CA,06,Alameda,06001,"FAA, OAKLAND AIR ROUTE TRAFFIC CONTROL CTR (ARTCC)",1053011,5125 CENTRAL AVENUE,FREMONT,94536,Nitrogen Oxides,CAP,0.32467145,TON,,488111,AIR TRAFFIC CONTROL.
CA,06,Alameda,06001,FEDERAL BUREAU OF PRISONS,18541011,FCI DUBLIN,DUBLIN,94568,Nitrogen Oxides,CAP,0.31362277,TON,,922140,CORRECTIONAL INSTITUTIONS.
CA,06,Alameda,06001,MILLS COLLEGE,14122011,5000 MACARTHUR BLVD,OAKLAND,94613,Nitrogen Oxides,CAP,0.313477004,TON,,611310,"COLLEGES, UNIVERSITIES, AND PROFESSIONAL SCHOOLS."
CA,06,Alameda,06001,"PLEASANTON GARBAGE SERVICE, INC",10457211,2512 VINEYARD AVENUE,PLEASANTON,94566,Nitrogen Oxides,CAP,0.312355243,TON,,562211,HAZARDOUS WASTE TREATMENT AND DISPOSAL.
CA,06,Alameda,06001,PACIFIC INTERMENT SERVICE,405911,1094 YERBA BUENA AVE,EMERYVILLE,94608,Nitrogen Oxides,CAP,0.30635149,TON,Crematory - Human,812210,FUNERAL HOMES AND FUNERAL SERVICES.
CA,06,Alameda,06001,ALAMEDA CREMATIONS,13985611,"2900 MAIN ST, SUITE 116",ALAMEDA,94501,Nitrogen Oxides,CAP,0.30360687,TON,,812210,FUNERAL HOMES AND FUNERAL SERVICES.
CA,06,Alameda,06001,NORTHERN CALIF POWER AGENCY,136511,2900 MAIN ST  SITE 1 OR 2,ALAMEDA,94501,Nitrogen Oxides,CAP,0.2985888,TON,Electricity Generation via Combustion,221112,FOSSIL FUEL ELECTRIC POWER GENERATION.
CA,06,Alameda,06001,"GLOBAL PLATING, INC",138611,44620 GRIMMER BLVD,FREMONT,94538,Nitrogen Oxides,CAP,0.29438322,TON,,332813,"ELECTROPLATING, PLATING, POLISHING, ANODIZING, AND COLORING."
CA,06,Alameda,06001,THORATEC LLC,15746711,6035 STONERIDGE DRIVE,PLEASANTON,94588,Nitrogen Oxides,CAP,0.293148076,TON,,334510,ELECTROMEDICAL AND ELECTROTHERAPEUTIC APPARATUS MANUFACTURING.
CA,06,Alameda,06001,MCGRATH RENT CORPORATION,10511311,5700 LAS POSITAS ROAD,LIVERMORE,94550,Nitrogen Oxides,CAP,0.2896337,TON,,316110,LEATHER AND HIDE TANNING AND FINISHING.
CA,06,Alameda,06001,COURTYARD BY MARRIOTT,10466411,5555 SHELLMOUND STREET,EMERYVILLE,94608,Nitrogen Oxides,CAP,0.28404172,TON,,721110,HOTELS (EXCEPT CASINO HOTELS) AND MOTELS.
CA,06,Alameda,06001,PEERLESS COFFEE CO,808811,260 OAK STREET,OAKLAND,94607,Nitrogen Oxides,CAP,0.27832998,TON,,311920,COFFEE AND TEA MANUFACTURING.
CA,06,Alameda,06001,SOUTHERN WINE AND SPIRITS,17251111,1555 ATLANTIC STREET,UNION CITY,94587,Nitrogen Oxides,CAP,0.275133599,TON,,312111,SOFT DRINK MANUFACTURING.
CA,06,Alameda,06001,ALAMEDA HEALTH SYSTEM - FAIRMONT HOSPITAL,450311,15400 FOOTHILL BOULEVARD,SAN LEANDRO,94578,Nitrogen Oxides,CAP,0.271902059,TON,"Institutional (school, hospital, prison, etc.)",622110,GENERAL MEDICAL AND SURGICAL HOSPITALS.
CA,06,Alameda,06001,EAST BAY MUNICIPAL UTILITY DIST,14241511,375 11TH STREET,OAKLAND,94607,Nitrogen Oxides,CAP,0.256170052,TON,,221310,WATER SUPPLY AND IRRIGATION SYSTEMS.
CA,06,Alameda,06001,SEEO INC,18539111,3906 TRUST WAY,HAYWARD,94545,Nitrogen Oxides,CAP,0.249985,TON,,541714,
CA,06,Alameda,06001,COLUMBUS,15718011,30977 SAN ANTONIO ST,HAYWARD,94544,Nitrogen Oxides,CAP,0.243372771,TON,,311999,ALL OTHER MISCELLANEOUS FOOD MANUFACTURING.
CA,06,Alameda,06001,"SYSCO SAN FRANCISCO, INC",10512411,5900 STEWART AVENUE,FREMONT,94538,Nitrogen Oxides,CAP,0.241760807,TON,,424410,GENERAL LINE GROCERY MERCHANT WHOLESALERS.
CA,06,Alameda,06001,CATHOLIC CREMATION SERVICES,199711,1051 HARDER ROAD,HAYWARD,94542,Nitrogen Oxides,CAP,0.23959163,TON,Crematory - Human,812210,FUNERAL HOMES AND FUNERAL SERVICES.
CA,06,Alameda,06001,OAKLAND CENTER 21,15942711,2101 WEBSTER STREET,OAKLAND,94612,Nitrogen Oxides,CAP,0.23499027,TON,,531120,LESSORS OF NONRESIDENTIAL BUILDINGS (EXCEPT MINIWAREHOUSES).
CA,06,Alameda,06001,"AGRICULTURAL BAG MFG, INC",13983311,960 98TH AVENUE,OAKLAND,94603,Nitrogen Oxides,CAP,0.2309271,TON,,326111,UNSUPPORTED PLASTICS BAG MANUFACTURING.
CA,06,Alameda,06001,ALAMEDA COUNTY WATER DISTRICT,13985511,1385 MOWRY AVENUE,FREMONT,94538,Nitrogen Oxides,CAP,0.2266795,TON,,221310,WATER SUPPLY AND IRRIGATION SYSTEMS.
CA,06,Alameda,06001,"CONSOLIDATED PRINTERS, INC",195711,2630 8TH STREET,BERKELEY,94710,Nitrogen Oxides,CAP,0.220309531,TON,,323111,COMMERCIAL GRAVURE PRINTING.
CA,06,Alameda,06001,CIM PROPERTIES,15941211,1333 BROADWAY,OAKLAND,94612,Nitrogen Oxides,CAP,0.22006495,TON,,531120,LESSORS OF NONRESIDENTIAL BUILDINGS (EXCEPT MINIWAREHOUSES).
CA,06,Alameda,06001,EAST BAY MUNICIPAL UTILITY DISTRICT,14182211,225 EMBARCADERO-WEST,OAKLAND,94606,Nitrogen Oxides,CAP,0.207611472,TON,,221310,WATER SUPPLY AND IRRIGATION SYSTEMS.
CA,06,Alameda,06001,CITY OF SAN LEANDRO,13818811,999 E 14TH STREET,SAN LEANDRO,94578,Nitrogen Oxides,CAP,0.2056295,TON,,922190,"OTHER JUSTICE, PUBLIC ORDER, AND SAFETY ACTIVITIES."
CA,06,Alameda,06001,STATE OF CALIFORNIA DEPARTMENT OF TRANSPORTATION,10497211,DUMBRTN BRDG TLL PLAZA,NEWARK,94560,Nitrogen Oxides,CAP,0.2047964,TON,,488111,AIR TRAFFIC CONTROL.
CA,06,Alameda,06001,ALAMEDA COUNTY PUBLIC WORKS AGENCY,15965411,"RUUS RD, FLOOD CNTRL",HAYWARD,94541,Nitrogen Oxides,CAP,0.202715721,TON,,925120,ADMINISTRATION OF URBAN PLANNING AND COMMUNITY AND RURAL DEVELOPMENT.
CA,06,Alameda,06001,MANHEIM SAN FRANCISCO BAY,15895111,29900 AUCTION WAY,HAYWARD,94544,Nitrogen Oxides,CAP,0.20047643,TON,"Auto Body, Painting, or Repair Shop",811121,"AUTOMOTIVE BODY, PAINT, AND INTERIOR REPAIR AND MAINTENANCE."
CA,06,Alameda,06001,CHAPEL OF THE CHIMES MEMORIAL PARK & FUNERAL HOME,407711,32992 MISSION BLVD,HAYWARD,94544,Nitrogen Oxides,CAP,0.19233502,TON,Crematory - Human,812210,FUNERAL HOMES AND FUNERAL SERVICES.
CA,06,Alameda,06001,LEVEL 3 COMMUNICATIONS INC,10512911,5000 HOLLIS STREET,EMERYVILLE,94608,Nitrogen Oxides,CAP,0.18767137,TON,,518210,"DATA PROCESSING, HOSTING, AND RELATED SERVICES."
CA,06,Alameda,06001,AMERICA'S BEST COFFEE ROASTING COMPANY,17245411,600 50TH AVENUE,OAKLAND,94601,Nitrogen Oxides,CAP,0.18292241,TON,,311920,COFFEE AND TEA MANUFACTURING.
CA,06,Alameda,06001,808 RENEWABLE ENERGY,10472611,1515 CLAY STREET,OAKLAND,94612,Nitrogen Oxides,CAP,0.18218142,TON,Electricity Generation via Combustion,221112,FOSSIL FUEL ELECTRIC POWER GENERATION.
CA,06,Alameda,06001,BANK OF AMERICA C/O JONES LANG LASALLE PEMC,15738111,3180 WHIPPLE ROAD,UNION CITY,94587,Nitrogen Oxides,CAP,0.1756382,TON,,523150,
CA,06,Alameda,06001,THERMO FISHER SCIENTIFIC,10491611,6055 SUNOL BOULEVARD,PLEASANTON,94566,Nitrogen Oxides,CAP,0.17289222,TON,,325412,PHARMACEUTICAL PREPARATION MANUFACTURING.
CA,06,Alameda,06001,PRIME SMOKED MEATS INC,17252811,220 ALICE STREET,OAKLAND,94607,Nitrogen Oxides,CAP,0.1703206,TON,,423490,OTHER PROFESSIONAL EQUIPMENT AND SUPPLIES MERCHANT WHOLESALERS.
CA,06,Alameda,06001,LIVERMORE MUNICIPAL WATER - VASCO RD PUMP STATION,16045011,6186 NORTHFRONT ROAD,LIVERMORE,94551,Nitrogen Oxides,CAP,0.1686696,TON,,221310,WATER SUPPLY AND IRRIGATION SYSTEMS.
CA,06,Alameda,06001,DEPARTMENT OF TRANSPORTATION,17245111,"TOLL OPERATIONS BLDG, SF OAKLAND BAY BRIDG",OAKLAND,94608,Nitrogen Oxides,CAP,0.1682003,TON,,221112,FOSSIL FUEL ELECTRIC POWER GENERATION.
CA,06,Alameda,06001,PIXAR ANIMATION STUDIOS,13773311,1215 45TH STREET,EMERYVILLE,94608,Nitrogen Oxides,CAP,0.1670896,TON,,512110,MOTION PICTURE AND VIDEO PRODUCTION.
CA,06,Alameda,06001,CHAPEL OF THE CHIMES,7845711,4499 PIEDMONT AVE,OAKLAND,94611,Nitrogen Oxides,CAP,0.16664745,TON,Crematory - Human,812210,FUNERAL HOMES AND FUNERAL SERVICES.
CA,06,Alameda,06001,ALAMEDA COUNTY GSA,1106211,661 WASHINGTON ST,OAKLAND,94611,Nitrogen Oxides,CAP,0.16240112,TON,,921190,OTHER GENERAL GOVERNMENT SUPPORT.
CA,06,Alameda,06001,PACIFIC BELL,127111,2116 BANCROFT WAY,BERKELEY,94704,Nitrogen Oxides,CAP,0.1623826,TON,,517111,
CA,06,Alameda,06001,SHAKLEE CORPORATION,17243311,4747 WILLOW ROAD,PLEASANTON,94588,Nitrogen Oxides,CAP,0.16130432,TON,,424210,DRUGS AND DRUGGISTS' SUNDRIES MERCHANT WHOLESALERS.
CA,06,Alameda,06001,PACIFIC BELL,127411,1129 B STREET,HAYWARD,94541,Nitrogen Oxides,CAP,0.1595207,TON,,517111,
CA,06,Alameda,06001,MR ESPRESSO,343011,696 3RD STREET,OAKLAND,94607,Nitrogen Oxides,CAP,0.156747281,TON,,311920,COFFEE AND TEA MANUFACTURING.
CA,06,Alameda,06001,GRISSOM'S CHAPEL & MORTUARY,17243511,267 E LEWELLING BLVD,SAN LORENZO,94580,Nitrogen Oxides,CAP,0.15521912,TON,,812220,CEMETERIES AND CREMATORIES.
CA,06,Alameda,06001,PREFERRED FREEZER SERVICES,17252111,400 POLAR WAY,SAN LEANDRO,94577,Nitrogen Oxides,CAP,0.151902854,TON,,493120,REFRIGERATED WAREHOUSING AND STORAGE.
CA,06,Alameda,06001,"HAYWARD POINT EDEN I, LP C/O CBRE",18545711,3955 POINT EDEN WAY,HAYWARD,94545,Nitrogen Oxides,CAP,0.151015,TON,,541611,ADMINISTRATIVE MANAGEMENT AND GENERAL MANAGEMENT CONSULTING SERVICES.
CA,06,Alameda,06001,ROSELAWN CEMETERY,197911,1240 N LIVERMORE AVE,LIVERMORE,94550,Nitrogen Oxides,CAP,0.149036515,TON,Crematory - Human,812210,FUNERAL HOMES AND FUNERAL SERVICES.
CA,06,Alameda,06001,PACIFIC BELL,128011,120 RAY STREET,PLEASANTON,94566,Nitrogen Oxides,CAP,0.1463837,TON,,517111,
CA,06,Alameda,06001,AGRICULTURAL RESEARCH SERVICE,139211,800 BUCHANAN STREET,ALBANY,94710,Nitrogen Oxides,CAP,0.146056597,TON,,926140,REGULATION OF AGRICULTURAL MARKETING AND COMMODITIES.
CA,06,Alameda,06001,COOKS COLLISION OF FREMONT,18491611,41041 ALBRAE STREET,FREMONT,94538,Nitrogen Oxides,CAP,0.14604054,TON,,811121,"AUTOMOTIVE BODY, PAINT, AND INTERIOR REPAIR AND MAINTENANCE."
CA,06,Alameda,06001,UNION PACIFIC RAILROAD,18134311,37105 MISSION BLVD,FREMONT,94536,Nitrogen Oxides,CAP,0.1458739,TON,,424710,PETROLEUM BULK STATIONS AND TERMINALS.
CA,06,Alameda,06001,BOEHRINGER INGELHEIM FREMONT INC,10511211,6701 KAISER DRIVE,FREMONT,94555,Nitrogen Oxides,CAP,0.14487729,TON,,325414,BIOLOGICAL PRODUCT (EXCEPT DIAGNOSTIC) MANUFACTURING.
CA,06,Alameda,06001,"JUDICIAL COUNCIL OF CALIFORNIA, JCC 01-D1",14305611,24405 AMADOR STREET,HAYWARD,94544,Nitrogen Oxides,CAP,0.14294379,TON,,921190,OTHER GENERAL GOVERNMENT SUPPORT.
CA,06,Alameda,06001,AT&T,14257911,4658 WILLOW ROAD,PLEASANTON,94566,Nitrogen Oxides,CAP,0.1377038,TON,,517111,
CA,06,Alameda,06001,SERVICE KING PAINT & BODY,18495411,4311 SOLAR WAY,FREMONT,94538,Nitrogen Oxides,CAP,0.1361977,TON,,811121,"AUTOMOTIVE BODY, PAINT, AND INTERIOR REPAIR AND MAINTENANCE."
CA,06,Alameda,06001,CITY OF HAYWARD WELL B,16023211,"28475 HESPERIAN BLVD, WELL B",HAYWARD,94545,Nitrogen Oxides,CAP,0.1344196,TON,,221112,FOSSIL FUEL ELECTRIC POWER GENERATION.
CA,06,Alameda,06001,GOLDEN STATE PET CREMATORIUM,18540611,2423 GROVE WAY,CASTRO VALLEY,94546,Nitrogen Oxides,CAP,0.13294756,TON,,541940,VETERINARY SERVICES.
CA,06,Alameda,06001,"UNION SANITARY DIST, IRVINGTON PS",10456411,46525 FREMONT BLVD,FREMONT,94536,Nitrogen Oxides,CAP,0.130799,TON,Wastewater Treatment Facility,221320,SEWAGE TREATMENT FACILITIES.
CA,06,Alameda,06001,U S ARMY GARRISON CAMP PARKS,10496811,EVANS AVE,DUBLIN,94568,Nitrogen Oxides,CAP,0.129967394,TON,Military Base,928110,NATIONAL SECURITY.
CA,06,Alameda,06001,EAST BAY MUNICIPAL UTILITY DIST,14179311,GOLDEN GATE AVENUE,OAKLAND,94618,Nitrogen Oxides,CAP,0.1292422,TON,,221310,WATER SUPPLY AND IRRIGATION SYSTEMS.
CA,06,Alameda,06001,"E INK CALIFORNIA, LLC",10492311,47485 SEABRIDGE DR,FREMONT,94538,Nitrogen Oxides,CAP,0.1277571,TON,,334513,"INSTRUMENTS AND RELATED PRODUCTS MANUFACTURING FOR MEASURING, DISPLAYING, AND CONTROLLING INDUSTRIAL PROCESS VARIABLES."
CA,06,Alameda,06001,"DAN'S WIRE MFG, INC",14247011,2156 PRUNE AVENUE,FREMONT,94539,Nitrogen Oxides,CAP,0.12687554,TON,,331318,
CA,06,Alameda,06001,CITY OF OAKLAND,18540811,"455 27TH ST, FIRE STATION 15",OAKLAND,94612,Nitrogen Oxides,CAP,0.1243323,TON,,922190,"OTHER JUSTICE, PUBLIC ORDER, AND SAFETY ACTIVITIES."
CA,06,Alameda,06001,DRAKE'S BREWING COMPANY,18698311,1933 DAVIS STRET #177,SAN LEANDRO,94577,Nitrogen Oxides,CAP,0.1240295,TON,,311942,SPICE AND EXTRACT MANUFACTURING.
CA,06,Alameda,06001,"CASS, INC",168411,2730 PERALTA STREET,OAKLAND,94607,Nitrogen Oxides,CAP,0.12352695,TON,,423930,RECYCLABLE MATERIAL MERCHANT WHOLESALERS.
CA,06,Alameda,06001,VERIZON BUSINESS - FRMOCA,13811411,4340 SOLAR WAY,FREMONT,94538,Nitrogen Oxides,CAP,0.1225728,TON,,517111,
CA,06,Alameda,06001,"LAKE MERRITT MANAGEMENT, LLC",15940511,155 GRAND AVENUE,OAKLAND,94612,Nitrogen Oxides,CAP,0.1224944,TON,,531120,LESSORS OF NONRESIDENTIAL BUILDINGS (EXCEPT MINIWAREHOUSES).
CA,06,Alameda,06001,AC TRANSIT GENERAL OFFICE,13980511,1600 FRANKLIN STREET,OAKLAND,94612,Nitrogen Oxides,CAP,0.1212826,TON,,488111,AIR TRAFFIC CONTROL.
CA,06,Alameda,06001,AT&T,14060011,4480 WILLOW ROAD,PLEASANTON,94588,Nitrogen Oxides,CAP,0.1204574,TON,,517112,
CA,06,Alameda,06001,FEDERAL AVIATION ADMINISTRATION,10490111,OAKLAND AIRPORT,OAKLAND,94621,Nitrogen Oxides,CAP,0.12026443,TON,,488111,AIR TRAFFIC CONTROL.
CA,06,Alameda,06001,PACIFIC BELL,127711,479 45TH STREET,OAKLAND,94609,Nitrogen Oxides,CAP,0.1161216,TON,,517111,
CA,06,Alameda,06001,"GRIFOLS DIAGNOSTIC SOLUTIONS, INC",10492511,6455 CHRISTIE AVENUE,EMERYVILLE,94608,Nitrogen Oxides,CAP,0.1143857,TON,,325412,PHARMACEUTICAL PREPARATION MANUFACTURING.
CA,06,Alameda,06001,"AEG MANAGEMENT OAKLAND, LLC",10496511,7000 COLLISEUM WAY,OAKLAND,94621,Nitrogen Oxides,CAP,0.111900673,TON,,925120,ADMINISTRATION OF URBAN PLANNING AND COMMUNITY AND RURAL DEVELOPMENT.
CA,06,Alameda,06001,SAN FRANCISCO PUBLIC UTILITIES COMMISSION,10479511,5555 CALAVERAS RD,SUNOL,94586,Nitrogen Oxides,CAP,0.111887526,TON,,926130,"REGULATION AND ADMINISTRATION OF COMMUNICATIONS, ELECTRIC, GAS, AND OTHER UTILITIES."
CA,06,Alameda,06001,CITY OF FREMONT,10491811,3300 CAPITOL AVENUE,FREMONT,94538,Nitrogen Oxides,CAP,0.11094737,TON,,921190,OTHER GENERAL GOVERNMENT SUPPORT.
CA,06,Alameda,06001,"ZP OPCO, INC",15725111,34790 ARDENTECH CT,FREMONT,94555,Nitrogen Oxides,CAP,0.110291888,TON,,221112,FOSSIL FUEL ELECTRIC POWER GENERATION.
CA,06,Alameda,06001,"CALIFORNIA CEREAL PRODUCTS, INC",10469511,1267 14TH STREET,OAKLAND,94607,Nitrogen Oxides,CAP,0.10943554,TON,,311230,BREAKFAST CEREAL MANUFACTURING.
CA,06,Alameda,06001,"LOWE'S HIW, INC ,CORPORATE PAYABLES",129311,4255 1ST STREET,LIVERMORE,94550,Nitrogen Oxides,CAP,0.1079345,TON,,444110,HOME CENTERS.
CA,06,Alameda,06001,"LOWE'S HIW, INC",10471911,43612 PACIFIC COMMONS BLVD,FREMONT,94538,Nitrogen Oxides,CAP,0.105917,TON,,444110,HOME CENTERS.
CA,06,Alameda,06001,COMCAST OF CALIFORNIA IX INC,16024811,395 MOWRY BOULEVARD,FREMONT,94536,Nitrogen Oxides,CAP,0.104635539,TON,,221112,FOSSIL FUEL ELECTRIC POWER GENERATION.
CA,06,Alameda,06001,"TRT NOIP DUBLIN, LP",18545311,1 SYBASE DRIVE,DUBLIN,94568,Nitrogen Oxides,CAP,0.10375526,TON,,541511,CUSTOM COMPUTER PROGRAMMING SERVICES.
CA,06,Alameda,06001,"COSCHEM, INC",14316711,8108 CAPWELL DRIVE,OAKLAND,94621,Nitrogen Oxides,CAP,0.1030554,TON,,325611,SOAP AND OTHER DETERGENT MANUFACTURING.
CA,06,Alameda,06001,EAST BAY MUNICIPAL UTILITY DIST,10501711,589 E LEWELLING BLVD,SAN LORENZO,94580,Nitrogen Oxides,CAP,0.1029847,TON,,221310,WATER SUPPLY AND IRRIGATION SYSTEMS.
CA,06,Alameda,06001,"FOX TELEVISION STATIONS, INC , ON BEHALF OF KTVU",17252711,2 JACK LONDON SQUARE,OAKLAND,94607,Nitrogen Oxides,CAP,0.1016785,TON,,516120,
CA,06,Alameda,06001,PACIFIC BELL,449611,4073 ADAMS AVENUE,FREMONT,94538,Nitrogen Oxides,CAP,0.09852746,TON,,517111,
CA,06,Alameda,06001,ACUITY BRANDS LIGHTING,10460411,2246 5TH STREET,BERKELEY,94710,Nitrogen Oxides,CAP,0.09799143,TON,,335132,
CA,06,Alameda,06001,ANTRIM ENGINEERING & CONSTRUCTION INC,13787511,1635 CHESTNUT STREET,LIVERMORE,94550,Nitrogen Oxides,CAP,0.09763525,TON,,236220,COMMERCIAL AND INSTITUTIONAL BUILDING CONSTRUCTION.
CA,06,Alameda,06001,CITY OF BERKELEY PUBLIC SAFETY BUILDING,17246611,2100 MRTN LTHR KNG JR WAY,BERKELEY,94704,Nitrogen Oxides,CAP,0.0972337,TON,,561110,OFFICE ADMINISTRATIVE SERVICES.
CA,06,Alameda,06001,CITY OF FREMONT DEVELOPMENT,15737611,39550 LIBERTY STREET,FREMONT,94538,Nitrogen Oxides,CAP,0.0968399,TON,,923130,"ADMINISTRATION OF HUMAN RESOURCE PROGRAMS (EXCEPT EDUCATION, PUBLIC HEALTH, AND VETERANS' AFFAIRS PROGRAMS)."
CA,06,Alameda,06001,CITY OF HAYWARD,18490011,777 B STREET,HAYWARD,94541,Nitrogen Oxides,CAP,0.09383566,TON,,921190,OTHER GENERAL GOVERNMENT SUPPORT.
CA,06,Alameda,06001,SBC ADVANCED SOLUTIONS INC,10482211,5130 HACIENDA DR,DUBLIN,94568,Nitrogen Oxides,CAP,0.09361394,TON,,541512,COMPUTER SYSTEMS DESIGN SERVICES.
CA,06,Alameda,06001,"MATTSON TECHNOLOGY, INC",10481811,47131 BAYSIDE PKWY,FREMONT,94538,Nitrogen Oxides,CAP,0.09287384,TON,,334413,SEMICONDUCTOR AND RELATED DEVICE MANUFACTURING.
CA,06,Alameda,06001,SERVICE KING PAINT & BODY,18495311,7801 OAKPORT STREET,OAKLAND,94621,Nitrogen Oxides,CAP,0.09012177,TON,,811121,"AUTOMOTIVE BODY, PAINT, AND INTERIOR REPAIR AND MAINTENANCE."
CA,06,Alameda,06001,BOEHRINGER INGELHEIM FREMONT INC,16033011,6397 KAISER DRIVE,FREMONT,94555,Nitrogen Oxides,CAP,0.09004044,TON,,325412,PHARMACEUTICAL PREPARATION MANUFACTURING.
CA,06,Alameda,06001,PACIFIC BELL,127311,1880 DEPOT COURT,HAYWARD,94545,Nitrogen Oxides,CAP,0.08867471,TON,,517111,
CA,06,Alameda,06001,SAN LEANDRO HOSPITAL,18541311,13855 E 14TH STREET,SAN LEANDRO,94578,Nitrogen Oxides,CAP,0.08657553,TON,,622110,GENERAL MEDICAL AND SURGICAL HOSPITALS.
CA,06,Alameda,06001,LIVERMORE CREMATORY,10457111,3833 EAST AVENUE,LIVERMORE,94550,Nitrogen Oxides,CAP,0.0836911,TON,,812210,FUNERAL HOMES AND FUNERAL SERVICES.
CA,06,Alameda,06001,FARBEN INC,14266911,31010 SAN CLEMENTE ST,HAYWARD,94544,Nitrogen Oxides,CAP,0.08342409,TON,,332812,"METAL COATING, ENGRAVING (EXCEPT JEWELRY AND SILVERWARE), AND ALLIED SERVICES TO MANUFACTURERS."
CA,06,Alameda,06001,WESTERN COLLOID PRODUCTS,200311,700 71ST AVENUE,OAKLAND,94621,Nitrogen Oxides,CAP,0.08291373,TON,Hot Mix Asphalt Plant,324121,ASPHALT PAVING MIXTURE AND BLOCK MANUFACTURING.
CA,06,Alameda,06001,"ROSEWOOD COMMONS PROPERTY OWNER, LLC",18495211,4430 ROSEWOOD DRIVE,PLEASANTON,94588,Nitrogen Oxides,CAP,0.081380529,TON,,517112,
CA,06,Alameda,06001,UCSF BENIOFF CHILDRENS HOSPITAL - OAKLAND - RI,10496311,5700 MARTIN LUTHR KNG,OAKLAND,94609,Nitrogen Oxides,CAP,0.07953795,TON,,622110,GENERAL MEDICAL AND SURGICAL HOSPITALS.
CA,06,Alameda,06001,FIFTH & POTTER STREET ASSOC,10488111,725 POTTER STREET,BERKELEY,94710,Nitrogen Oxides,CAP,0.07741442,TON,,531120,LESSORS OF NONRESIDENTIAL BUILDINGS (EXCEPT MINIWAREHOUSES).
CA,06,Alameda,06001,PACIFIC BELL,172211,8925 HOLLY STREET,OAKLAND,94621,Nitrogen Oxides,CAP,0.07717984,TON,,517111,
CA,06,Alameda,06001,STATE OF CALIFORNIA DEPARTMENT OF TRANSPORTATION,10497311,"SAN MATEO HAYWRD, BRIDGE TOLL PLAZA",HAYWARD,94541,Nitrogen Oxides,CAP,0.07657919,TON,,488111,AIR TRAFFIC CONTROL.
CA,06,Alameda,06001,MENTOR GRAPHICS,15725311,46871 BAYSIDE PKWY,FREMONT,94538,Nitrogen Oxides,CAP,0.07651888,TON,,541430,GRAPHIC DESIGN SERVICES.
CA,06,Alameda,06001,METROPCS CALIFORNIA/FLORIDA INC,10506911,720 2ND STREET,OAKLAND,94607,Nitrogen Oxides,CAP,0.07541853,TON,,221112,FOSSIL FUEL ELECTRIC POWER GENERATION.
CA,06,Alameda,06001,WORLDPAC,17242711,37137 HICKORY ST,NEWARK,94560,Nitrogen Oxides,CAP,0.07513658,TON,,423120,MOTOR VEHICLE SUPPLIES AND NEW PARTS MERCHANT WHOLESALERS
CA,06,Alameda,06001,CALTRANS,18130311,200 BURMA ROAD,OAKLAND,94607,Nitrogen Oxides,CAP,0.07494062,TON,,485112,COMMUTER RAIL SYSTEMS.
CA,06,Alameda,06001,MASS PRECISION INC,18134811,46555 LANDING PKWY,FREMONT,94538,Nitrogen Oxides,CAP,0.07425565,TON,,332322,SHEET METAL WORK MANUFACTURING.
CA,06,Alameda,06001,WELLS FARGO BANK C/O JONES LANG LASALLE,17249111,"794 DAVIS STREET, ROOM 120",SAN LEANDRO,94577,Nitrogen Oxides,CAP,0.07413019,TON,,522110,COMMERCIAL BANKING.
CA,06,Alameda,06001,THE POINT AT ROCKRIDGE,10491211,4500 GILBERT STREET,OAKLAND,94611,Nitrogen Oxides,CAP,0.073232405,TON,,623110,NURSING CARE FACILITIES.
CA,06,Alameda,06001,OAKLAND MARRIOTT CITY CENTER,18542011,1001 BROADWAY,OAKLAND,94607,Nitrogen Oxides,CAP,0.07279431,TON,,721110,HOTELS (EXCEPT CASINO HOTELS) AND MOTELS.
CA,06,Alameda,06001,KAISER PERMANENTE BERKELEY CAMPUS,13760711,1725 EASTSHORE HWY,BERKELEY,94710,Nitrogen Oxides,CAP,0.072076059,TON,,622110,GENERAL MEDICAL AND SURGICAL HOSPITALS.
CA,06,Alameda,06001,KAISER/APRIA,10493111,30116 EIGENBRODT WAY,UNION CITY,94587,Nitrogen Oxides,CAP,0.07014216,TON,,622110,GENERAL MEDICAL AND SURGICAL HOSPITALS.
CA,06,Alameda,06001,"XO COMMUNICATIONS SERVICES, LLC",14286411,855 MISSION COURT,FREMONT,94539,Nitrogen Oxides,CAP,0.07014216,TON,,517111,
CA,06,Alameda,06001,LAWRENCE LIVERMORE NATIONAL LAB,13815611,"CORRAL HOLLOW RD, SITE 300",TRACY,95304,Nitrogen Oxides,CAP,0.06873464,TON,,928110,NATIONAL SECURITY.
